<?xml version="1.0" encoding="UTF-8"?>
<AppVet xmlns="http://appvet.github.io/appvet/schemas" xmlns:xsi="http://www.w3.org/2001/XMLSchema-instance"
	xsi:schemaLocation="http://appvet.github.io/appvet/schemas AppVetProperties.xsd">

	<Admin>
		<!-- Initial username does not have to be 'admin'. -->
		<Username>johndoe</Username>
		<Password>JoHnDoE</Password>
	</Admin>

	<Host>
		<!-- Hostname examples: 'myhost.example.gov' or '123.45.6.7'. For local 
			development, use 'localhost'. Make sure that these parameters match your 
			Tomcat configuration. -->
		<Hostname>localhost</Hostname>
		<SSL>false</SSL>
		<Port>8080</Port>
	</Host>

	<!-- Use only if AppVet behind proxy (e.g., <ProxyUrl>https://test.example.com:8443</Proxy) -->
	<Proxy></Proxy>

	<Logging>
		<Level>DEBUG</Level>
		<!-- For development, set ToConsole to true to view logging in Eclipse 
			console. For production deployment, set to false. -->
		<ToConsole>true</ToConsole>
	</Logging>
	
	<UseSSO>true</UseSSO>

	<OrgLogoAltText>My org logo ALT text!</OrgLogoAltText>

	<Sessions>
		<Timeout>1800000</Timeout>
		<GetUpdatesDelay>5000</GetUpdatesDelay>
	</Sessions>

	<Database>
		<URL>jdbc:mysql://localhost</URL>
		<UserName>root</UserName>
		<Password>dbpassword1</Password>
	</Database>
	
	<!-- EMAIL OPTIONAL

    <Email>
		<SMTPHost>smtp.test.com</SMTPHost>
		<SMTPPort>25</SMTPPort>
		<EnableTLS>true</EnableTLS>
		<SenderEmail>appvet@test.com</SenderEmail>
		<SenderName>My AppVet</SenderName>
		<SMTPAuth>true</SMTPAuth>
		<SenderEmailPassword>MyEmailPassword</SenderEmailPassword>
	</Email>
-->

	<ToolServices>
		<PollingInterval>2000</PollingInterval>
		<StaggerInterval>1000</StaggerInterval>
		<ConnectionTimeout>30000</ConnectionTimeout>
		<SocketTimeout>1200000</SocketTimeout>
		<!-- 3600000ms = 1hr tool timeout. Note that tools might have their own 
			timeout which may be less or greater than this timeout. -->
		<Timeout>3600000</Timeout>
	</ToolServices>

	<Apps>
		<KeepApps>false</KeepApps>
	</Apps>

</AppVet>